{
  "decisionId": "decision:allow-alice-read-case-plan",
  "decision": "allow",
  "subjectId": "user:alice",
  "action": "read",
  "resourceId": "document:case-plan",
  "reasonCode": "ALLOW_VIA_RELATIONSHIP_PATH",
  "policyVersion": "policy:test-v1",
  "modelVersion": "model:test-v1",
  "relationshipVersion": "tuple-set:test-v1",
  "tupleVersion": "tuple:test-v1",
  "contextVersion": "context:test-v1",
  "asOf": "2026-05-21T17:00:00.000Z",
  "relationshipPath": [
    {
      "subjectId": "user:alice",
      "relation": "member_of",
      "objectId": "group:case-team"
    },
    {
      "subjectId": "group:case-team",
      "relation": "contributor_to",
      "objectId": "workspace:case"
    },
    {
      "subjectId": "workspace:case",
      "relation": "contains",
      "objectId": "document:case-plan"
    }
  ],
  "constraints": {
    "deterministic": true,
    "denyByDefault": true,
    "llmDecisioning": false,
    "explain": true
  },
  "evaluatedAt": "2026-05-21T17:00:00.000Z"
}
